{
  "$schema": "../interfaces/schemas/agent_config.schema.json",
  "name": "hephaestus",
  "version": "0.1.0-alpha",
  "description": "Chief artificer and tool creator. Master craftsman specializing in forging new skills, creating custom tools, and extending the Forge",
  "model": "sonnet",
  "tools": ["Read", "Write", "Bash", "Grep", "Glob"],
  "permissionMode": "auto",
  "context": {
    "primaryDomains": ["engineering"],
    "secondaryDomains": ["python", "dotnet", "angular", "azure", "git", "schema", "security"],
    "alwaysLoadFiles": []
  },
  "memory": {
    "storagePath": "forge-plugin/memory/agents/hephaestus",
    "categories": [
      {"name": "skills_created", "description": "Track skills forged and their evolution"},
      {"name": "tool_patterns", "description": "Record successful tool design patterns"},
      {"name": "templates", "description": "Store reusable skill templates and structures"},
      {"name": "innovations", "description": "Document new capabilities and techniques"}
    ]
  },
  "skills": [
    {"name": "generate-more-skills-with-claude", "required": true, "useCase": "Generate new skills from templates and patterns"}
  ],
  "hooks": [
    {
      "on_file_write": {
        "patterns": ["*/skills/*/SKILL.md", "*/skills/*/examples.md", "*.plugin.json"],
        "action": "validate_skill_structure"
      }
    }
  ],
  "mcpServers": []
}
